ID_num,job_title,Short_description,Skills_required,Industry,Pay_grade
280,Precision Agriculture Specialist,Use technology to optimize crop production,['agricultural science gps technology data analysis problem solving innovation'],Agriculture,High paying
281,Disaster Response Coordinator,Organize emergency relief efforts and resources,['emergency management leadership communication crisis management resource allocation'],Emergency Services,Average paying
282,Molecular Gastronomy Chef,Create innovative culinary experiences using science,['culinary arts chemistry innovation creativity problem solving'],Food Service,High paying
283,Augmented Reality Developer,Create applications that blend digital and physical worlds,['programming 3d modeling user experience innovation problem solving'],Technology,High paying
284,Marine Archaeologist,Study underwater historical sites and artifacts,['archaeology diving skills historical research attention to detail documentation'],Cultural Heritage,Average paying
285,Bioinformatics Specialist,Analyze biological data using computational methods,['biology programming data analysis mathematical modeling research skills'],Science & Research,High paying
286,Sustainable Architecture Designer,Design environmentally friendly buildings and structures,['architecture environmental science energy systems creative design project management'],Architecture,High paying
287,Telepresence Robot Operator,Control remote robots for various applications,['technical skills problem solving communication spatial awareness attention to detail'],Technology,Average paying
288,Coral Reef Restoration Specialist,Rehabilitate damaged marine ecosystems,['marine biology environmental science diving skills project management problem solving'],Environmental Services,High paying
289,Space Weather Forecaster,Predict solar activity and its effects on Earth,['astronomy data analysis mathematical modeling research skills communication'],Space Science,High paying
290,Bioprinting Technician,Operate 3D printers that create biological tissues,['biology 3d printing technology medical knowledge attention to detail innovation'],Biotechnology,High paying
291,Smart City Planner,Design technology integrated urban environments,['urban planning technology systems analysis innovation strategic thinking'],Urban Development,High paying
292,Neuroengineering Researcher,Develop brain computer interfaces and neural devices,['neuroscience engineering programming innovation problem solving'],Science & Research,High paying
293,Cryptocurrency Mining Coordinator,Manage digital currency mining operations,['blockchain technology computer hardware energy management problem solving technical skills'],Technology,High paying
294,Vertical Farm Manager,Oversee indoor agricultural production systems,['agricultural science hydroponics technology management environmental control problem solving'],Agriculture,High paying
295,Ocean Thermal Energy Specialist,Harness temperature differences in oceans for power,['marine engineering renewable energy thermodynamics problem solving innovation'],Renewable Energy,High paying
296,Autonomous Vehicle Tester,Test and validate self driving car systems,['automotive technology safety protocols problem solving attention to detail data analysis'],Automotive,High paying
297,Cellular Agriculture Scientist,Develop lab grown meat and dairy products,['biology food science innovation problem solving research skills'],Food Science,High paying
298,Digital Twin Engineer,Create virtual replicas of physical systems,['engineering programming data analysis systems modeling innovation'],Technology,High paying
299,Space Elevator Engineer,Design transportation systems between Earth and space,['aerospace engineering materials science physics innovation problem solving'],Aerospace,High paying
300,Quantum Cryptography Specialist,Develop ultra secure communication systems using quantum mechanics,['quantum physics cryptography programming security protocols innovation'],Technology,High paying
301,Atmospheric River Forecaster,Predict extreme weather patterns and flooding,['meteorology data analysis mathematical modeling research skills communication'],Weather Services,High paying
302,Biocement Engineer,Develop self healing concrete and construction materials,['materials science biology engineering innovation problem solving'],Construction,High paying
303,Neural Dust Researcher,Create wireless brain monitoring systems,['neuroscience electronics miniaturization innovation problem solving'],Science & Research,High paying
304,Swarm Robotics Coordinator,Manage groups of autonomous robots working together,['robotics programming systems coordination problem solving innovation'],Technology,High paying
305,Atmospheric Carbon Capture Specialist,Design systems to remove CO2 from the atmosphere,['environmental engineering chemistry innovation problem solving climate science'],Environmental Services,High paying
306,Quantum Sensor Developer,Create ultra precise measurement instruments,['quantum physics engineering innovation problem solving technical skills'],Technology,High paying
307,Synthetic Spider Silk Producer,Manufacture artificial spider silk for various applications,['biology materials science manufacturing innovation problem solving'],Biotechnology,High paying
308,Asteroid Mining Planner,Design systems for extracting resources from asteroids,['aerospace engineering mining engineering space science innovation strategic planning'],Aerospace,High paying
309,Metamaterial Engineer,Design materials with properties not found in nature,['materials science physics engineering innovation problem solving'],Engineering,High paying
310,Biocomputer Programmer,Develop computing systems using biological components,['biology programming innovation problem solving technical skills'],Biotechnology,High paying
311,Magnetic Levitation Engineer,Design transportation systems using magnetic forces,['electrical engineering physics transportation innovation problem solving'],Transportation,High paying
312,Genetically Modified Organism Regulator,Oversee safety of modified organisms,['biology regulatory knowledge risk assessment communication ethical reasoning'],Government,High paying
313,Fusion Energy Researcher,Develop clean energy through nuclear fusion,['nuclear physics engineering research skills innovation problem solving'],Energy Research,High paying
314,Bioluminescent Lighting Designer,Create sustainable lighting using living organisms,['biology lighting design innovation environmental science problem solving'],Biotechnology,High paying
315,Hypersonic Flight Engineer,Design aircraft capable of extreme speeds,['aerospace engineering aerodynamics innovation problem solving technical skills'],Aerospace,High paying
316,Microbiome Analyst,Study beneficial bacteria in humans and environment,['microbiology research skills data analysis laboratory techniques innovation'],Science & Research,High paying
317,Gravity Wave Detector Operator,Monitor cosmic gravitational disturbances,['physics data analysis technical skills attention to detail research skills'],Science & Research,High paying
318,Programmable Matter Engineer,Design materials that can change shape and properties,['materials science programming physics innovation problem solving'],Engineering,High paying
319,Exoplanet Hunter,Search for planets outside our solar system,['astronomy data analysis research skills mathematical modeling attention to detail'],Space Science,High paying
320,Biorefinery Process Engineer,Convert biological waste into useful products,['chemical engineering biology environmental science innovation problem solving'],Biotechnology,High paying
321,Telepathic Interface Developer,Create brain to brain communication systems,['neuroscience programming innovation problem solving technical skills'],Science & Research,High paying
322,Molecular Assembler Technician,Build products atom by atom using nanotechnology,['nanotechnology precision manufacturing technical skills innovation problem solving'],Manufacturing,High paying
323,Terraforming Specialist,Design systems to make planets habitable for humans,['planetary science environmental engineering innovation strategic planning problem solving'],Aerospace,High paying
324,Time Crystal Researcher,Study materials with repeating patterns in time,['quantum physics research skills mathematical modeling innovation problem solving'],Science & Research,High paying
325,Bioharmonic Therapist,Use biological frequencies to treat medical conditions,['biology medical knowledge therapeutic techniques innovation problem solving'],Healthcare,High paying
326,Music Therapist,Use music interventions to address physical emotional and social needs,['empathy musical skills therapeutic techniques active listening patient care'],Healthcare,Average paying
327,Digital Archivist,Preserve and organize digital cultural heritage materials,['information science digital preservation metadata standards organization technical skills'],Cultural Heritage,Average paying
328,Ethical AI Auditor,Evaluate artificial intelligence systems for bias and fairness,['machine learning ethics critical thinking problem solving communication'],Technology,High paying
329,Wilderness Guide,Lead outdoor expeditions and teach survival skills,['outdoor skills safety awareness leadership navigation physical fitness'],Recreation,Average paying
330,Marine Salvage Diver,Recover sunken vessels and underwater equipment,['deep sea diving technical skills problem solving risk assessment physical fitness'],Maritime,High paying
331,Flavor Chemist,Develop artificial and natural flavors for food products,['chemistry sensory analysis innovation research skills quality control'],Food Science,High paying
332,Pet Grief Counselor,Support families through loss of companion animals,['counseling skills empathy communication animal behavior understanding grief support'],Animal Services,Average paying
333,Virtual Interior Designer,Create 3D interior spaces for online clients,['interior design 3d modeling software skills creativity communication'],Design Services,Average paying
334,Bee Removal Specialist,Safely relocate bee colonies without harm,['animal handling safety protocols problem solving environmental awareness customer service'],Pest Control,Average paying
335,Sign Language Interpreter,Facilitate communication for deaf and hearing individuals,['sign language fluency cultural awareness communication attention to detail empathy'],Professional Services,Average paying
336,Crime Prevention Specialist,Analyze crime patterns and develop prevention strategies,['data analysis criminal justice research skills communication strategic planning'],Law Enforcement,Average paying
337,Equine Therapist,Provide therapeutic services using horses,['animal training therapy techniques empathy physical coordination safety awareness'],Healthcare,Average paying
338,Digital Detox Coach,Help individuals reduce technology dependency and digital overwhelm,['counseling skills psychology technology awareness communication goal setting'],Wellness,Average paying
339,Fossil Preparator,Clean and prepare fossils for research and display,['manual dexterity scientific knowledge attention to detail patience laboratory skills'],Science & Research,Average paying
340,Rope Access Technician,Perform maintenance on tall structures using climbing techniques,['physical fitness safety protocols problem solving manual dexterity risk assessment'],Maintenance Services,Average paying
341,Medical Scribe,Document patient encounters for healthcare providers,['medical terminology typing skills attention to detail communication organization'],Healthcare,Low paying
342,Urban Beekeeper,Manage bee colonies in city environments,['beekeeping skills urban planning environmental awareness problem solving seasonal planning'],Agriculture,Average paying
343,Disaster Victim Advocate,Support individuals affected by natural disasters,['crisis counseling communication empathy resource coordination problem solving'],Social Services,Average paying
344,Genealogy Researcher,Trace family histories and ancestral connections,['research skills historical knowledge database management communication attention to detail'],Professional Services,Average paying
345,Commercial Fisherman,Harvest fish and seafood for commercial markets,['maritime skills physical stamina safety awareness weather assessment equipment operation'],Fishing,Average paying
346,Sleep Disorder Specialist,Diagnose and treat sleep related medical conditions,['medical knowledge patient assessment diagnostic skills communication problem solving'],Healthcare,High paying
347,Digital Rights Advocate,Protect online privacy and digital freedoms,['legal knowledge technology understanding advocacy skills communication research skills'],Legal Services,Average paying
348,Aerial Photography Pilot,Capture images and video from aircraft or drones,['aviation skills photography technical equipment visual composition safety protocols'],Photography,Average paying
349,Kombucha Brewer,Ferment and produce probiotic beverages,['fermentation science quality control food safety creativity problem solving'],Food Production,Average paying
350,Memory Care Specialist,Provide specialized care for dementia and Alzheimer patients,['patient care compassion communication problem solving medical knowledge'],Healthcare,Average paying
351,Cave Rescue Technician,Perform emergency rescues in underground environments,['technical rescue skills physical fitness problem solving safety protocols risk assessment'],Emergency Services,Average paying
352,Digital Accessibility Consultant,Ensure websites and apps are usable by people with disabilities,['web development accessibility standards problem solving communication technical skills'],Technology,Average paying
353,Butterfly Conservationist,Protect and restore butterfly habitats and populations,['entomology environmental science research skills conservation biology fieldwork'],Environmental Services,Average paying
354,Voice Recognition Trainer,Improve speech recognition software accuracy,['linguistics computer science audio processing communication technical skills'],Technology,Average paying
355,Competitive Eating Coach,Train professional competitive eaters,['nutrition knowledge coaching skills psychology performance analysis safety awareness'],Sports,Low paying
356,Digital Nomad Consultant,Help remote workers optimize location independent careers,['business consulting technology skills communication cultural awareness travel planning'],Consulting,Average paying
357,Soap Maker,Create artisanal soaps and personal care products,['chemistry creativity quality control safety protocols customer service'],Manufacturing,Low paying
358,Storm Chaser,Document severe weather phenomena for research and media,['meteorology photography safety protocols problem solving risk assessment'],Weather Services,Average paying
359,Candle Maker,Design and manufacture decorative and functional candles,['craftsmanship creativity safety protocols quality control customer service'],Manufacturing,Low paying
360,Meditation Teacher,Instruct individuals and groups in mindfulness practices,['mindfulness training communication empathy teaching skills stress management'],Wellness,Low paying
361,Digital Nomad Tax Advisor,Provide tax services for location independent workers,['tax law international regulations communication problem solving attention to detail'],Financial Services,Average paying
362,Terrarium Designer,Create miniature ecosystems in glass containers,['botany creativity attention to detail customer service environmental knowledge'],Design Services,Low paying
363,Sleep Study Technician,Monitor patients during overnight sleep assessments,['medical technology patient care attention to detail technical equipment problem solving'],Healthcare,Average paying
364,Urban Forager,Identify and harvest edible plants in city environments,['botany foraging skills safety awareness environmental knowledge teaching skills'],Environmental Services,Low paying
365,Cord Blood Bank Coordinator,Manage collection and storage of umbilical cord blood,['medical knowledge organization communication attention to detail quality control'],Healthcare,Average paying
366,Sensory Deprivation Tank Operator,Maintain flotation therapy equipment and facilities,['customer service equipment maintenance safety protocols problem solving relaxation techniques'],Wellness,Low paying
367,Digital Estate Planner,Help families manage digital assets after death,['estate planning technology skills communication problem solving legal knowledge'],Legal Services,Average paying
368,Mushroom Forager,Identify and harvest wild mushrooms for culinary use,['mycology safety protocols foraging skills environmental knowledge risk assessment'],Food Services,Average paying
369,Color Consultant,Advise on color schemes for interior and exterior spaces,['color theory creativity communication visual skills customer service'],Design Services,Average paying
370,Escape Room Designer,Create puzzle based entertainment experiences,['creative problem solving game design engineering customer experience innovation'],Entertainment,Average paying
371,Digital Minimalism Coach,Help people simplify their digital lives and reduce screen time,['psychology communication goal setting technology awareness lifestyle coaching'],Wellness,Average paying
372,Tiny House Builder,Construct small scale living spaces and mobile homes,['construction skills spatial design problem solving creativity customer service'],Construction,Average paying
373,Aquarium Maintenance Specialist,Care for fish tanks and aquatic ecosystems,['aquatic biology water chemistry equipment maintenance customer service problem solving'],Pet Services,Low paying
374,Professional Organizer,Help individuals and businesses organize their spaces,['organization skills problem solving communication customer service time management'],Professional Services,Average paying
375,Digital Marketing Automation Specialist,Create automated marketing campaigns and workflows,['marketing technology programming analytics creative thinking'],Marketing,High paying
376,Permaculture Designer,Design sustainable agricultural and living systems,['ecological design environmental science agriculture problem solving systems thinking'],Environmental Services,Average paying
377,Home Energy Auditor,Assess residential energy efficiency and recommend improvements,['energy systems knowledge problem solving communication attention to detail technical skills'],Energy Services,Average paying
378,Pet Portrait Artist,Create artistic representations of companion animals,['artistic skills animal behavior customer service creativity communication'],Arts & Crafts,Low paying
379,Digital Privacy Consultant,Advise individuals and organizations on online privacy protection,['cybersecurity legal knowledge communication problem solving technology skills'],Technology,Average paying
380,Bereavement Photographer,Document final moments and memorial services for families,['photography empathy discretion communication artistic skills'],Photography,Average paying
381,Fermentation Specialist,Develop fermented foods and beverages for commercial production,['food science microbiology quality control innovation problem solving'],Food Production,Average paying
382,Digital Asset Recovery Specialist,Help retrieve lost cryptocurrency and digital files,['cybersecurity problem solving attention to detail communication technical skills'],Technology,High paying
383,Mushroom Cultivation Specialist,Grow exotic and medicinal mushrooms for commercial use,['mycology agriculture environmental control quality control problem solving'],Agriculture,Average paying
384,Virtual Reality Therapist,Use VR technology to treat phobias and mental health conditions,['psychology technology skills therapeutic techniques empathy innovation'],Healthcare,High paying
385,Disaster Recovery Pet Rescuer,Save and care for animals during natural disasters,['animal handling emergency response physical fitness problem solving empathy'],Emergency Services,Low paying
386,Digital Content Moderator,Review and filter online content for appropriateness,['attention to detail critical thinking communication problem solving cultural awareness'],Technology,Low paying
387,Rare Book Restorer,Preserve and repair historical manuscripts and texts,['manual dexterity historical knowledge attention to detail patience craftsmanship'],Cultural Heritage,Average paying
388,Urban Sketching Instructor,Teach drawing techniques for capturing city scenes,['artistic skills teaching communication creativity observational skills'],Arts & Culture,Low paying
389,Digital Wellness Coach,Help individuals develop healthy relationships with technology,['psychology communication goal setting technology awareness lifestyle coaching'],Wellness,Average paying
390,Vintage Clothing Curator,Authenticate and preserve historical garments and fashion,['fashion history research skills attention to detail communication textile knowledge'],Fashion,Average paying
391,Sound Bath Practitioner,Provide therapeutic sound healing sessions,['musical skills healing techniques communication empathy mindfulness'],Wellness,Low paying
392,Edible Landscape Designer,Create gardens that produce food while maintaining aesthetic appeal,['horticulture landscape design sustainability creativity problem solving'],Landscaping,Average paying
393,Digital Sabbath Consultant,Help individuals and organizations implement technology breaks,['psychology communication time management wellness coaching technology awareness'],Wellness,Average paying
394,Mushroom Identification Guide,Lead foraging expeditions and teach mushroom safety,['mycology teaching skills safety protocols communication environmental knowledge'],Education,Low paying
395,Virtual Event Producer,Organize and manage online conferences and gatherings,['event planning technology skills communication problem solving project management'],Event Planning,Average paying
396,Pollinator Garden Designer,Create spaces that support bees butterflies and other pollinators,['ecology horticulture environmental science creativity problem solving'],Environmental Services,Average paying
397,Digital Legacy Planner,Help people prepare their online presence for after death,['technology planning communication legal knowledge problem solving'],Professional Services,Average paying
398,Rain Water Harvesting Specialist,Design systems to collect and utilize rainwater,['environmental engineering water management problem solving sustainability planning'],Environmental Services,Average paying
399,Mindful Eating Coach,Teach individuals to develop healthy relationships with food,['nutrition psychology communication empathy goal setting'],Wellness,Average paying
400,Digital Detox Retreat Leader,Organize and lead technology free wellness experiences,['event planning communication leadership wellness coaching outdoor skills'],Wellness,Average paying
401,Heritage Breed Livestock Conservationist,Preserve rare and endangered farm animal breeds,['animal husbandry conservation biology genetics agriculture problem solving'],Agriculture,Average paying
402,Online Community Manager,Build and moderate digital communities for brands and organizations,['communication social media marketing community building problem solving'],Marketing,Average paying
403,Greywater System Designer,Create systems to reuse household wastewater,['plumbing engineering environmental science problem solving sustainability planning'],Environmental Services,Average paying
404,Digital Nomad Insurance Advisor,Provide coverage solutions for location independent workers,['insurance knowledge travel regulations communication problem solving risk assessment'],Insurance,Average paying
405,Seed Bank Curator,Preserve plant genetic diversity through seed collection and storage,['botany conservation biology organization research skills problem solving'],Environmental Services,Average paying
406,Virtual Assistant Trainer,Teach skills for remote administrative support work,['business skills communication teaching technology skills organization'],Professional Services,Average paying
407,Sustainable Fashion Consultant,Advise on environmentally conscious clothing choices,['fashion knowledge environmental awareness communication sustainability problem solving'],Fashion,Average paying
408,Digital Archaeology Researcher,Use technology to study ancient civilizations and artifacts,['archaeology technology skills research methods data analysis problem solving'],Cultural Heritage,High paying
409,Microgreen Farmer,Grow nutrient dense young vegetables for restaurants and markets,['agriculture hydroponics quality control customer service problem solving'],Agriculture,Low paying
410,Online Learning Designer,Create educational courses and training programs for digital platforms,['instructional design communication technology skills creativity problem solving'],Education,Average paying
411,Wetland Restoration Specialist,Rehabilitate damaged aquatic ecosystems and habitats,['environmental science ecology project management problem solving research skills'],Environmental Services,Average paying
412,Digital Product Designer,Create user centered digital products and applications,['user experience design problem solving creativity technology skills communication'],Technology,High paying
413,Heirloom Tomato Grower,Cultivate rare and heritage varieties of tomatoes,['agriculture horticulture quality control customer service problem solving'],Agriculture,Low paying
414,Remote Team Building Facilitator,Organize activities to strengthen distributed teams,['communication leadership psychology team dynamics problem solving'],Human Resources,Average paying
