ID_num,job_title,Short_description,Skills_required,Industry,Pay_grade
546,Graphic Designer,Create visual content for various media and platforms,['graphic design; adobe creative suite; visual communication; brand guidelines; creativity'],Creative Services,Average paying
547,Sales Development Representative,Generate leads and qualify prospects for sales team,['lead generation; crm systems; communication; sales process; prospecting'],Sales,Average paying
548,Manufacturing Engineer,Optimize manufacturing processes and production efficiency,['manufacturing processes; lean manufacturing; cad; process improvement; quality control'],Manufacturing,Average paying
549,Tax Accountant,Prepare and file tax returns for individuals and businesses,['tax law; accounting software; attention to detail; analytical skills; communication'],Finance,Average paying
550,Content Marketing Manager,Develop content strategies to drive brand awareness and engagement,['content strategy; seo; analytics; brand management; creative writing'],Marketing,Average paying
551,Help Desk Technician,Provide first-level technical support to end users,['technical support; troubleshooting; customer service; it systems; communication'],Technology,Low paying
552,Administrative Assistant,Provide administrative support to executives and teams,['office administration; calendar management; communication; microsoft office; organization'],Business Services,Low paying
553,Customer Service Representative,Handle customer inquiries and resolve issues,['customer service; communication; problem solving; crm systems; patience'],Customer Service,Low paying
554,Data Entry Clerk,Input and maintain accurate data in computer systems,['data entry; attention to detail; typing speed; database software; accuracy'],Business Services,Low paying
555,Receptionist,Greet visitors and manage front desk operations,['customer service; phone etiquette; scheduling; communication; professional appearance'],Business Services,Low paying
556,Warehouse Associate,Handle inventory management and order fulfillment,['inventory management; physical stamina; attention to detail; warehouse management systems; safety'],Warehousing,Low paying
557,Retail Sales Associate,Assist customers with purchases and product information,['customer service; sales skills; product knowledge; cash handling; communication'],Retail,Low paying
558,Food Service Worker,Prepare and serve food in restaurant or cafeteria settings,['food preparation; customer service; sanitation; teamwork; physical stamina'],Food Service,Low paying
559,Security Guard,Monitor premises and ensure safety and security,['security procedures; observation skills; communication; physical fitness; emergency response'],Security,Low paying
560,Janitor,Maintain cleanliness and sanitation of facilities,['cleaning techniques; equipment operation; attention to detail; physical stamina; time management'],Cleaning Services,Low paying
561,Delivery Driver,Transport goods and packages to customers,['driving skills; navigation; customer service; time management; physical stamina'],Transportation,Low paying
562,Cashier,Process customer transactions and handle payments,['cash handling; customer service; attention to detail; point of sale systems; mathematics'],Retail,Low paying
563,Maintenance Worker,Perform routine maintenance and repairs on facilities,['maintenance skills; tool usage; problem solving; safety protocols; physical skills'],Maintenance Services,Low paying
564,Landscaping Worker,Maintain and beautify outdoor spaces and gardens,['landscaping; plant knowledge; equipment operation; physical stamina; attention to detail'],Landscaping,Low paying
565,Kitchen Assistant,Support kitchen operations in food service establishments,['food preparation; sanitation; teamwork; physical stamina; following instructions'],Food Service,Low paying
566,Parking Attendant,Manage parking facilities and assist customers,['customer service; cash handling; attention to detail; physical activity; communication'],Facilities Management,Low paying
567,Farm Worker,Perform agricultural tasks and crop maintenance,['agricultural skills; physical stamina; equipment operation; seasonal work; attention to detail'],Agriculture,Low paying
568,Housekeeping Aide,Clean and maintain residential or commercial properties,['cleaning skills; attention to detail; time management; physical stamina; reliability'],Cleaning Services,Low paying
569,Library Assistant,Support library operations and help patrons,['customer service; organization; computer skills; attention to detail; communication'],Education,Low paying
570,Assembly Line Worker,Assemble products on manufacturing production lines,['manual dexterity; attention to detail; teamwork; physical stamina; quality control'],Manufacturing,Low paying
571,Childcare Worker,Supervise and care for children in daycare settings,['child development; patience; communication; safety awareness; creativity'],Education,Low paying
572,Dog Walker,Provide exercise and care services for pets,['animal handling; physical fitness; reliability; love for animals; communication'],Pet Services,Low paying
573,Dishwasher,Clean dishes and maintain kitchen sanitation,['sanitation; physical stamina; teamwork; attention to detail; following instructions'],Food Service,Low paying
574,Hotel Housekeeper,Clean and maintain hotel rooms and facilities,['cleaning skills; attention to detail; time management; physical stamina; hospitality'],Hospitality,Low paying
575,Telemarketer,Make outbound calls to promote products or services,['communication; persistence; sales skills; computer skills; stress management'],Sales,Low paying
576,Product Manager,Define product strategy and coordinate development teams,['product management; market research; stakeholder management; analytics; strategic thinking'],Technology,High paying
577,Principal Data Scientist,Lead data science initiatives and advanced analytics projects,['advanced statistics; machine learning; team leadership; business strategy; python/r'],Technology,High paying
578,Senior DevOps Engineer,Design and implement CI/CD pipelines and infrastructure automation,['devops; kubernetes; cloud platforms; infrastructure as code; automation'],Technology,High paying
579,Enterprise Architect,Design enterprise-wide technology architecture and standards,['enterprise architecture; system integration; technology strategy; leadership; communication'],Technology,High paying
580,Chief Marketing Officer,Develop and execute comprehensive marketing strategies,['marketing strategy; brand management; digital marketing; team leadership; analytics'],Executive Leadership,High paying
581,Investment Manager,Manage investment portfolios and client relationships,['portfolio management; financial analysis; risk management; client relations; market knowledge'],Finance,High paying
582,Cardiologist,Diagnose and treat heart and cardiovascular conditions,['medical expertise; diagnostic skills; patient care; surgical skills; continuous learning'],Healthcare,High paying
583,Patent Attorney,Provide legal counsel on intellectual property matters,['patent law; technical knowledge; legal research; writing skills; analytical thinking'],Legal Services,High paying
584,Principal Software Engineer,Lead complex software development projects and technical decisions,['advanced programming; system design; technical leadership; code review; mentoring'],Technology,High paying
585,Head of Product,Oversee product portfolio and strategic product direction,['product strategy; market analysis; team leadership; stakeholder management; innovation'],Technology,High paying
586,Senior Management Consultant,Advise executives on strategic business transformations,['strategic analysis; change management; client management; industry expertise; leadership'],Consulting,High paying
587,Chief Data Officer,Lead enterprise data strategy and governance initiatives,['data strategy; data governance; analytics; leadership; digital transformation'],Executive Leadership,High paying
588,Interventional Radiologist,Perform minimally invasive medical procedures using imaging guidance,['medical imaging; surgical skills; patient care; technical expertise; precision'],Healthcare,High paying
589,Hedge Fund Manager,Manage investment funds and trading strategies,['investment strategy; risk management; financial markets; quantitative analysis; leadership'],Finance,High paying
590,VP of Engineering,Lead engineering organizations and technical strategy,['engineering leadership; technical strategy; team building; product development; innovation'],Technology,High paying
591,Senior Business Analyst,Analyze business processes and recommend improvements,['business analysis; process modeling; stakeholder management; requirements gathering; communication'],Business Services,Average paying
592,Marketing Automation Specialist,Implement and manage marketing automation campaigns,['marketing automation; email marketing; crm systems; analytics; campaign management'],Marketing,Average paying
593,Technical Support Engineer,Provide advanced technical support for software products,['technical troubleshooting; customer service; software knowledge; communication; problem solving'],Technology,Average paying
594,Operations Coordinator,Coordinate operational activities and process improvements,['operations management; project coordination; process improvement; communication; organization'],Business Services,Average paying
595,HR Business Partner,Provide strategic HR support to business units,['hr strategy; employee relations; talent management; business acumen; communication'],Human Resources,Average paying
596,Financial Controller,Oversee financial reporting and accounting operations,['financial reporting; accounting standards; team management; budgeting; compliance'],Finance,Average paying
597,Product Marketing Manager,Develop go-to-market strategies for products,['product marketing; market research; competitive analysis; campaign management; communication'],Marketing,Average paying
598,Site Reliability Engineer,Ensure reliability and performance of production systems,['system reliability; monitoring; automation; incident response; performance optimization'],Technology,Average paying
599,Learning and Development Specialist,Design and deliver employee training programs,['training design; adult learning; facilitation; lms administration; assessment'],Human Resources,Average paying
600,Business Development Manager,Identify and pursue new business opportunities,['business development; sales strategy; relationship building; market analysis; negotiation'],Sales,Average paying
601,Junior Software Developer,Develop software applications under senior guidance,['programming; debugging; version control; testing; learning agility'],Technology,Average paying
602,Marketing Coordinator,Support marketing campaigns and activities,['marketing support; content creation; social media; event coordination; communication'],Marketing,Average paying
603,Accounts Receivable Specialist,Manage customer billing and payment collection,['accounts receivable; billing systems; customer service; attention to detail; communication'],Finance,Average paying
604,IT Support Specialist,Provide technical support for hardware and software issues,['it support; hardware troubleshooting; software installation; customer service; documentation'],Technology,Average paying
605,Logistics Coordinator,Coordinate shipments and supply chain activities,['logistics; inventory management; communication; organization; problem solving'],Logistics,Average paying
606,Junior Graphic Designer,Create visual designs for various marketing materials,['graphic design; adobe creative suite; brand guidelines; creativity; time management'],Creative Services,Average paying
607,Customer Success Manager,Ensure customer satisfaction and retention,['customer success; relationship management; product knowledge; communication; problem solving'],Business Services,Average paying
608,Payroll Specialist,Process payroll and maintain employee compensation records,['payroll processing; payroll software; attention to detail; confidentiality; compliance'],Human Resources,Average paying
609,Research Assistant,Support research projects and data collection activities,['research methods; data collection; literature review; analytical skills; organization'],Science & Research,Average paying
610,Junior Accountant,Assist with accounting tasks and financial record keeping,['accounting; financial reporting; bookkeeping; attention to detail; analytical skills'],Finance,Average paying
611,Social Worker,Provide support services to individuals and families in need,['social work; case management; counseling; advocacy; empathy'],Social Services,Average paying
612,Occupational Therapist,Help patients develop or recover daily living skills,['occupational therapy; patient assessment; treatment planning; rehabilitation; empathy'],Healthcare,Average paying
613,Physical Therapist,Provide rehabilitation services for patients with physical injuries,['physical therapy; anatomy; exercise prescription; patient care; manual therapy'],Healthcare,Average paying
614,Dental Hygienist,Provide preventive dental care and patient education,['dental hygiene; patient care; dental equipment; health education; attention to detail'],Healthcare,Average paying
615,Registered Nurse,Provide direct patient care in healthcare settings,['nursing; patient care; medical procedures; documentation; empathy'],Healthcare,Average paying
616,Elementary School Teacher,Educate and nurture young students in elementary grades,['teaching; curriculum development; classroom management; child development; patience'],Education,Average paying
617,High School Teacher,Educate students in specific subject areas,['subject matter expertise; teaching; lesson planning; classroom management; communication'],Education,Average paying
618,Librarian,Manage library resources and assist patrons with information needs,['library science; information management; research skills; customer service; organization'],Education,Average paying
619,Mental Health Counselor,Provide counseling services to individuals with mental health issues,['counseling; psychology; active listening; empathy; treatment planning'],Healthcare,Average paying
620,Veterinary Technician,Assist veterinarians with animal care and medical procedures,['veterinary medicine; animal handling; medical equipment; patient care; attention to detail'],Animal Services,Average paying
621,File Clerk,Organize and maintain filing systems and records,['filing systems; organization; attention to detail; data entry; record keeping'],Business Services,Low paying
622,Ticket Taker,Collect tickets and direct patrons at entertainment venues,['customer service; crowd management; attention to detail; communication; standing'],Entertainment,Low paying
623,Concession Stand Worker,Sell food and beverages at entertainment venues,['food service; cash handling; customer service; inventory management; teamwork'],Food Service,Low paying
624,Usher,Guide and assist patrons at theaters and entertainment venues,['customer service; crowd management; communication; physical activity; attention to detail'],Entertainment,Low paying
625,Groundskeeper,Maintain outdoor grounds and facilities,['landscaping; equipment operation; physical labor; attention to detail; weather tolerance'],Landscaping,Low paying
626,Laundry Attendant,Operate laundry equipment and fold clothing,['laundry operations; equipment operation; attention to detail; physical stamina; time management'],Personal Services,Low paying
627,Car Wash Attendant,Clean vehicles using various cleaning techniques,['vehicle cleaning; physical labor; attention to detail; customer service; teamwork'],Automotive,Low paying
628,Grocery Store Clerk,Stock shelves and assist customers in grocery stores,['inventory management; customer service; physical labor; attention to detail; teamwork'],Retail,Low paying
629,Fast Food Worker,Prepare and serve food in fast-food restaurants,['food preparation; customer service; speed; teamwork; sanitation'],Food Service,Low paying
630,Movie Theater Attendant,Assist customers and maintain theater facilities,['customer service; cleaning; crowd management; communication; physical activity'],Entertainment,Low paying
631,Newspaper Delivery,Deliver newspapers to subscribers,['driving/cycling; route management; time management; physical activity; reliability'],Media & Publishing,Low paying
632,Pet Groomer,Provide grooming services for pets,['animal handling; grooming techniques; customer service; patience; physical stamina'],Pet Services,Low paying
633,Furniture Mover,Transport furniture and household items,['physical strength; lifting techniques; customer service; teamwork; problem solving'],Moving Services,Low paying
634,Valet Parking Attendant,Park and retrieve vehicles for customers,['driving skills; customer service; physical activity; attention to detail; time management'],Hospitality,Low paying
635,Tour Guide,Lead tours and provide information to visitors,['public speaking; local knowledge; customer service; communication; walking/standing'],Tourism,Low paying
636,Amusement Park Attendant,Operate rides and assist guests at amusement parks,['safety procedures; customer service; equipment operation; physical activity; attention to detail'],Recreation,Low paying
637,Golf Course Maintenance,Maintain golf course grounds and facilities,['landscaping; equipment operation; physical labor; attention to detail; early hours'],Recreation,Low paying
638,Lifeguard,Monitor swimming areas and ensure safety of swimmers,['swimming skills; cpr/first aid; safety awareness; physical fitness; vigilance'],Recreation,Low paying
639,Ski Lift Operator,Operate ski lifts and assist skiers,['equipment operation; customer service; safety procedures; physical activity; weather tolerance'],Recreation,Low paying
640,Boat Rental Attendant,Rent boats and provide safety instructions,['boating knowledge; customer service; safety procedures; physical activity; communication'],Recreation,Low paying
641,Senior Quality Engineer,Lead quality assurance programs and process improvements,['quality management; statistical analysis; process improvement; leadership; compliance'],Manufacturing,High paying
642,Director of Operations,Oversee operational excellence and strategic initiatives,['operations management; strategic planning; leadership; process optimization; p&l management'],Business Services,High paying
643,Principal UX Designer,Lead user experience design for complex digital products,['ux design; design systems; user research; prototyping; design leadership'],Technology,High paying
644,Senior Research Scientist,Conduct advanced research and lead scientific projects,['research methodology; scientific analysis; grant writing; team leadership; publication'],Science & Research,High paying
645,Chief Technology Officer,Define technology vision and lead engineering organizations,['technology strategy; engineering leadership; innovation; digital transformation; executive management'],Executive Leadership,High paying
646,Investment Banking Director,Lead M&A transactions and client relationships,['corporate finance; deal structuring; client management; team leadership; financial modeling'],Finance,High paying
647,Chief Operating Officer,Oversee all operational aspects of the organization,['operations strategy; executive leadership; process optimization; change management; p&l management'],Executive Leadership,High paying
648,Senior Tax Manager,Manage complex tax planning and compliance for corporations,['tax strategy; corporate tax; regulatory compliance; team leadership; financial planning'],Finance,High paying
649,Principal Solutions Architect,Design enterprise-level technical solutions,['solution architecture; technical leadership; client consulting; system integration; innovation'],Technology,High paying
650,VP of Sales,Lead sales organization and revenue growth strategies,['sales leadership; revenue strategy; team building; market development; executive presence'],Sales,High paying
651,Digital Product Manager,Manage digital product development and user experience,['product management; digital strategy; user experience; agile development; analytics'],Technology,Average paying
652,Brand Manager,Develop and execute brand strategies and campaigns,['brand management; marketing strategy; campaign development; market research; creative direction'],Marketing,Average paying
653,Compensation Analyst,Analyze and design employee compensation programs,['compensation analysis; hr analytics; market research; statistical analysis; excel'],Human Resources,Average paying
654,Network Engineer,Design and maintain network infrastructure,['network engineering; cisco technologies; troubleshooting; security; documentation'],Technology,Average paying
655,Training Manager,Develop and oversee organizational training programs,['training management; curriculum development; adult learning; team leadership; assessment'],Human Resources,Average paying
656,Business Operations Analyst,Analyze business operations and recommend improvements,['operations analysis; process mapping; data analysis; project management; communication'],Business Services,Average paying
657,Email Marketing Specialist,Develop and execute email marketing campaigns,['email marketing; marketing automation; a/b testing; analytics; creative writing'],Marketing,Average paying
658,Application Support Analyst,Provide support for business applications and systems,['application support; troubleshooting; sql; business analysis; customer service'],Technology,Average paying
659,Budget Analyst,Analyze budgets and financial planning for organizations,['budget analysis; financial planning; excel; cost analysis; forecasting'],Finance,Average paying
660,Facilities Manager,Manage building operations and maintenance,['facilities management; vendor management; maintenance planning; budgeting; safety compliance'],Facilities Management,Average paying
661,Junior Marketing Assistant,Support marketing activities and campaigns,['marketing support; social media; content creation; administrative tasks; communication'],Marketing,Low paying
662,Office Assistant,Provide general administrative support to office staff,['administrative support; filing; phone answering; data entry; customer service'],Business Services,Low paying
663,Inventory Clerk,Track and manage inventory levels and stock movements,['inventory management; data entry; attention to detail; computer skills; organization'],Warehousing,Low paying
664,Mail Clerk,Sort and distribute mail within organization,['mail sorting; organization; attention to detail; physical activity; time management'],Postal Services,Low paying
665,Copy Machine Operator,Operate copy machines and handle print requests,['equipment operation; attention to detail; customer service; organization; basic maintenance'],Business Services,Low paying
666,Parking Meter Attendant,Monitor parking meters and issue citations,['enforcement; walking; attention to detail; customer service; record keeping'],Government,Low paying
667,Survey Taker,Conduct surveys and collect data from respondents,['data collection; communication; attention to detail; patience; computer skills'],Research & Development,Low paying
668,Telemarketing Assistant,Make calls to promote products or gather information,['communication; phone skills; data entry; persistence; customer service'],Sales,Low paying
669,Cleaning Service Worker,Clean offices and commercial buildings,['cleaning techniques; attention to detail; physical stamina; time management; reliability'],Cleaning Services,Low paying
670,Landscape Laborer,Perform basic landscaping tasks and maintenance,['physical labor; basic landscaping; equipment use; teamwork; weather tolerance'],Landscaping,Low paying
671,Construction Laborer,Assist with construction projects and manual labor,['physical labor; construction safety; tool usage; teamwork; following instructions'],Construction,Low paying
672,Kitchen Prep Cook,Prepare ingredients and assist with food preparation,['food preparation; kitchen safety; sanitation; teamwork; time management'],Food Service,Low paying
673,Dishwasher/Busser,Clean dishes and maintain dining area cleanliness,['cleaning; physical stamina; teamwork; time management; attention to detail'],Food Service,Low paying
674,Retail Stock Clerk,Receive and stock merchandise in retail stores,['inventory management; physical labor; attention to detail; organization; teamwork'],Retail,Low paying
675,Gas Station Attendant,Assist customers with fuel and vehicle services,['customer service; cash handling; basic automotive; attention to detail; physical activity'],Automotive,Low paying
676,Animal Kennel Worker,Care for animals in kennels and shelters,['animal care; cleaning; physical stamina; patience; attention to detail'],Animal Services,Low paying
677,Recycling Worker,Sort and process recyclable materials,['sorting; physical labor; attention to detail; environmental awareness; teamwork'],Environmental Services,Low paying
678,Sign Holder,Hold advertising signs to promote businesses,['physical stamina; weather tolerance; reliability; attention to detail; customer interaction'],Advertising,Low paying
679,Leaflet Distributor,Distribute flyers and promotional materials,['physical activity; customer interaction; reliability; time management; communication'],Advertising,Low paying
680,Event Setup Worker,Set up equipment and decorations for events,['physical labor; attention to detail; teamwork; time management; following instructions'],Event Planning,Low paying
681,Senior VP of Technology,Lead technology transformation and innovation initiatives,['technology leadership; digital transformation; strategic planning; innovation management; executive leadership'],Executive Leadership,High paying
