ID_num,job_title,Short_description,Skills_required,Industry,Pay_grade
1,Software Engineer,Develop and maintain web applications using modern frameworks,['problem solving logical reasoning attention to detail team collaboration critical thinking'],Technology,High paying
2,Data Scientist,Analyze large datasets to extract business insights and build predictive models,['analytical thinking pattern recognition mathematical reasoning problem solving research skills'],Technology,High paying
3,Marketing Manager,Lead marketing campaigns and brand strategy development,['creative thinking strategic planning communication leadership project management'],Marketing,Average paying
4,UX Designer,Design user-friendly interfaces and improve user experience,['creative problem solving empathy research skills visual thinking user-centered design'],Technology,Average paying
5,Financial Analyst,Analyze financial data and prepare reports for investment decisions,['analytical thinking attention to detail mathematical reasoning critical thinking report writing'],Finance,Average paying
6,Project Manager,Coordinate cross-functional teams to deliver projects on time and budget,['leadership organization time management communication risk assessment'],Business Services,Average paying
7,Sales Representative,Generate leads and close deals with potential customers,['persuasion communication relationship building resilience goal orientation'],Sales,Average paying
8,HR Specialist,Manage recruitment processes and employee relations,['interpersonal skills communication conflict resolution organizational skills discretion'],Human Resources,Average paying
9,Graphic Designer,Create visual content for marketing materials and brand assets,['creativity visual communication color theory artistic skills brand awareness'],Creative Services,Average paying
10,Business Analyst,Analyze business processes and recommend improvements,['analytical thinking process improvement problem solving communication systems thinking'],Business Services,Average paying
11,Content Writer,Create engaging content for websites blogs and marketing materials,['creative writing research skills communication adaptability time management'],Media & Publishing,Average paying
12,Network Administrator,Maintain and troubleshoot computer networks and systems,['problem solving technical troubleshooting logical reasoning attention to detail patience'],Technology,Average paying
13,Accountant,Prepare financial statements and manage accounting records,['mathematical accuracy attention to detail organizational skills analytical thinking ethics'],Finance,Average paying
14,Customer Service Representative,Provide support to customers via phone email and chat,['active listening patience problem solving communication empathy'],Customer Service,Low paying
15,Operations Manager,Oversee daily operations and optimize business processes,['leadership process improvement decision making strategic thinking team management'],Business Services,Average paying
16,DevOps Engineer,Implement CI/CD pipelines and manage cloud infrastructure,['problem solving systems thinking automation mindset continuous learning technical troubleshooting'],Technology,High paying
17,Quality Assurance Tester,Test software applications to identify bugs and ensure quality,['attention to detail critical thinking problem solving patience systematic thinking'],Technology,Average paying
18,Social Media Manager,Manage social media presence and create engaging content,['creative thinking trend awareness communication brand awareness community building'],Marketing,Average paying
19,Research Scientist,Conduct scientific research and publish findings,['critical thinking research skills analytical reasoning persistence scientific writing'],Research & Development,High paying
20,Legal Assistant,Support lawyers with case preparation and legal documentation,['attention to detail research skills organization confidentiality time management'],Legal Services,Average paying
21,Web Developer,Build and maintain websites using various programming languages,['problem solving creative thinking attention to detail continuous learning adaptability'],Technology,Average paying
22,Nurse,Provide patient care in healthcare settings,['compassion clinical judgment communication attention to detail stress management'],Healthcare,Average paying
23,Teacher,Educate students and develop curriculum for classroom instruction,['communication patience creativity organization adaptability'],Education,Average paying
24,Mechanical Engineer,Design and develop mechanical systems and products,['problem solving mathematical reasoning spatial reasoning critical thinking project management'],Engineering,High paying
25,Digital Marketing Specialist,Execute digital marketing campaigns across multiple channels,['analytical thinking creative problem solving data interpretation communication trend awareness'],Marketing,Average paying
26,Database Administrator,Manage and maintain database systems and ensure data integrity,['logical reasoning problem solving attention to detail systems thinking security awareness'],Technology,Average paying
27,Administrative Assistant,Provide administrative support to executives and teams,['organization multitasking communication attention to detail discretion'],Business Services,Low paying
28,Video Editor,Edit and produce video content for various media platforms,['creativity attention to detail time management visual storytelling technical aptitude'],Media & Publishing,Average paying
29,Cybersecurity Analyst,Monitor and protect computer systems from security threats,['critical thinking problem solving attention to detail ethical reasoning continuous learning'],Technology,High paying
30,Supply Chain Coordinator,Manage inventory and coordinate logistics operations,['organization analytical thinking communication problem solving time management'],Logistics,Average paying
31,Mobile App Developer,Develop mobile applications for iOS and Android platforms,['problem solving logical reasoning user experience design attention to detail innovation'],Technology,High paying
32,Interior Designer,Design interior spaces for residential and commercial properties,['creativity spatial reasoning communication client relations project management'],Design Services,Average paying
33,Electrical Engineer,Design electrical systems and troubleshoot electrical problems,['problem solving mathematical reasoning safety awareness attention to detail critical thinking'],Engineering,High paying
34,Marketing Coordinator,Support marketing initiatives and coordinate promotional activities,['organization communication creative thinking time management attention to detail'],Marketing,Low paying
35,Technical Writer,Create technical documentation and user manuals,['communication clarity logical organization research skills attention to detail'],Media & Publishing,Average paying
36,Pharmacist,Dispense medications and provide pharmaceutical care to patients,['attention to detail communication patient care scientific knowledge ethical reasoning'],Healthcare,High paying
37,Product Manager,Define product strategy and coordinate product development,['strategic thinking leadership communication market awareness decision making'],Technology,High paying
38,Event Planner,Plan and coordinate events from conception to execution,['organization time management communication problem solving attention to detail'],Hospitality,Average paying
39,Speech Therapist,Provide therapy services to patients with communication disorders,['patience communication assessment skills empathy problem solving'],Healthcare,Average paying
40,Civil Engineer,Design and supervise construction of infrastructure projects,['problem solving mathematical reasoning safety awareness project management critical thinking'],Engineering,High paying
41,SEO Specialist,Optimize websites to improve search engine rankings,['analytical thinking research skills attention to detail strategic thinking continuous learning'],Marketing,Average paying
42,Physical Therapist,Provide rehabilitation services to patients with injuries,['empathy physical assessment communication patience problem solving'],Healthcare,High paying
43,Investment Advisor,Provide financial advice and investment recommendations to clients,['analytical thinking communication risk assessment trust building financial acumen'],Finance,High paying
44,Veterinarian,Provide medical care to animals and educate pet owners,['compassion problem solving communication scientific knowledge stress management'],Healthcare,High paying
45,Real Estate Agent,Help clients buy sell and rent properties,['communication negotiation market knowledge relationship building persistence'],Real Estate,Average paying
46,Chef,Prepare meals and manage kitchen operations,['creativity time management leadership attention to detail stress management'],Food Service,Average paying
47,Translator,Translate written and spoken content between languages,['language proficiency cultural awareness attention to detail communication adaptability'],Professional Services,Average paying
48,Architect,Design buildings and oversee construction projects,['creativity problem solving spatial reasoning communication project management'],Architecture,High paying
49,Occupational Therapist,Help patients develop skills for daily living activities,['empathy problem solving communication assessment skills patience'],Healthcare,High paying
50,Construction Manager,Oversee construction projects and manage construction teams,['leadership problem solving safety awareness time management communication'],Construction,High paying
51,Fashion Designer,Design clothing and accessories for various markets,['creativity trend awareness visual skills innovation color theory'],Fashion,Average paying
52,Massage Therapist,Provide therapeutic massage services to clients,['physical dexterity empathy communication client care attention to detail'],Healthcare,Average paying
53,Insurance Agent,Sell insurance policies and provide customer service,['communication persuasion risk assessment trust building problem solving'],Insurance,Average paying
54,Dental Hygienist,Provide dental cleaning and preventive care services,['attention to detail patient care communication manual dexterity safety awareness'],Healthcare,Average paying
55,Personal Trainer,Provide fitness training and exercise guidance to clients,['motivation communication goal setting safety awareness adaptability'],Fitness & Recreation,Low paying
56,Photographer,Capture and edit photographs for various purposes,['creativity visual composition attention to detail communication technical aptitude'],Creative Services,Average paying
57,Landscaper,Design and maintain outdoor spaces and gardens,['creativity physical stamina attention to detail planning problem solving'],Landscaping,Low paying
58,Electrician,Install and repair electrical systems in buildings,['problem solving safety awareness manual dexterity attention to detail logical reasoning'],Construction,Average paying
59,Plumber,Install and repair plumbing systems and fixtures,['problem solving manual dexterity safety awareness attention to detail physical stamina'],Construction,Average paying
60,Carpenter,Build and repair wooden structures and furniture,['manual dexterity problem solving attention to detail spatial reasoning craftsmanship'],Construction,Average paying
61,Auto Mechanic,Diagnose and repair automotive problems,['problem solving logical reasoning manual dexterity attention to detail continuous learning'],Automotive,Average paying
62,Hair Stylist,Provide hair cutting styling and coloring services,['creativity communication client relations manual dexterity trend awareness'],Personal Care,Low paying
63,Dental Assistant,Assist dentists with patient care and office procedures,['attention to detail patient care communication organization multitasking'],Healthcare,Low paying
64,Bartender,Prepare and serve alcoholic and non-alcoholic beverages,['communication multitasking customer service memory creativity'],Food Service,Low paying
65,Security Guard,Monitor and protect property and people,['vigilance communication problem solving stress management physical fitness'],Security,Low paying
66,Flight Attendant,Ensure passenger safety and comfort during flights,['communication safety awareness customer service stress management cultural sensitivity'],Aviation,Average paying
67,Truck Driver,Transport goods safely and efficiently over long distances,['safety awareness time management navigation stress management physical stamina'],Transportation,Average paying
68,Receptionist,Greet visitors and handle phone calls and appointments,['communication organization multitasking customer service attention to detail'],Business Services,Low paying
69,Janitor,Maintain cleanliness and sanitation of buildings,['attention to detail time management physical stamina safety awareness work ethic'],Facilities Management,Low paying
70,Cashier,Process customer transactions and provide customer service,['attention to detail communication customer service mathematical accuracy multitasking'],Retail,Low paying
71,Waiter,Serve food and beverages to restaurant customers,['communication customer service multitasking memory physical stamina'],Food Service,Low paying
72,Retail Sales Associate,Assist customers and process sales transactions,['communication customer service persuasion product knowledge patience'],Retail,Low paying
73,Library Assistant,Help patrons find resources and maintain library organization,['research skills communication organization customer service attention to detail'],Education,Low paying
74,Museum Curator,Manage museum collections and educational programs,['research skills communication organization cultural awareness project management'],Arts & Culture,Average paying
75,Park Ranger,Protect natural resources and educate visitors about parks,['communication environmental awareness safety skills leadership physical fitness'],Government,Average paying
76,Fire Fighter,Respond to emergency situations and provide fire suppression,['physical fitness teamwork stress management problem solving safety awareness'],Public Safety,Average paying
77,Police Officer,Enforce laws and maintain public safety,['communication problem solving physical fitness ethical reasoning stress management'],Public Safety,Average paying
78,Paramedic,Provide emergency medical care and transport patients,['quick decision making stress management communication empathy physical fitness'],Healthcare,Average paying
79,Social Worker,Provide support services to individuals and families,['empathy communication problem solving advocacy skills stress management'],Social Services,Average paying
80,Psychologist,Provide mental health assessment and therapy services,['active listening empathy analytical thinking communication ethical reasoning'],Healthcare,High paying
81,Radiologic Technologist,Perform medical imaging procedures for diagnosis,['attention to detail safety awareness communication technical aptitude patient care'],Healthcare,Average paying
82,Medical Assistant,Provide clinical and administrative support in healthcare,['multitasking communication organization attention to detail empathy'],Healthcare,Low paying
83,Laboratory Technician,Perform laboratory tests and analyze samples,['attention to detail safety awareness analytical thinking organization technical aptitude'],Healthcare,Average paying
84,Pharmacist Technician,Assist pharmacists with medication preparation and inventory,['attention to detail organization communication customer service mathematical accuracy'],Healthcare,Low paying
85,Optician,Fit and dispense eyeglasses and contact lenses,['customer service attention to detail communication manual dexterity problem solving'],Healthcare,Average paying
86,Respiratory Therapist,Provide respiratory care to patients with breathing disorders,['patient care communication assessment skills problem solving stress management'],Healthcare,Average paying
87,Dietitian,Provide nutrition counseling and meal planning services,['communication analytical thinking empathy research skills health awareness'],Healthcare,Average paying
88,Environmental Scientist,Study environmental problems and develop solutions,['research skills analytical thinking problem solving communication environmental awareness'],Environmental Services,High paying
89,Geologist,Study earth materials and processes for various applications,['research skills analytical thinking problem solving physical stamina attention to detail'],Mining & Resources,High paying
90,Meteorologist,Study weather patterns and provide weather forecasts,['analytical thinking pattern recognition communication data interpretation mathematical reasoning'],Science & Research,High paying
91,Astronomer,Study celestial objects and phenomena in space,['research skills mathematical reasoning pattern recognition analytical thinking patience'],Science & Research,High paying
92,Biologist,Study living organisms and biological processes,['research skills analytical thinking problem solving attention to detail scientific writing'],Science & Research,High paying
93,Chemist,Conduct chemical research and analysis for various applications,['analytical thinking safety awareness problem solving attention to detail research skills'],Science & Research,High paying
94,Physicist,Study matter energy and their interactions,['mathematical reasoning analytical thinking problem solving research skills abstract thinking'],Science & Research,High paying
95,Mathematician,Solve mathematical problems and develop mathematical theories,['logical reasoning abstract thinking problem solving pattern recognition analytical thinking'],Science & Research,High paying
96,Statistician,Analyze data and develop statistical models,['analytical thinking mathematical reasoning pattern recognition attention to detail research skills'],Science & Research,High paying
97,Economist,Study economic trends and analyze economic data,['analytical thinking research skills critical thinking mathematical reasoning communication'],Economics,High paying
98,Political Scientist,Study political systems and analyze political behavior,['research skills analytical thinking critical thinking communication writing skills'],Social Sciences,High paying
99,Sociologist,Study human society and social behavior,['research skills analytical thinking communication cultural awareness critical thinking'],Social Sciences,High paying
100,Anthropologist,Study human culture and social organization,['research skills cultural awareness communication analytical thinking adaptability'],Social Sciences,High paying
101,Historian,Research and analyze historical events and trends,['research skills analytical thinking writing skills critical thinking attention to detail'],Education,Average paying
102,Journalist,Research and report news stories for various media,['research skills communication writing skills curiosity time management'],Media & Publishing,Average paying
103,Editor,Review and edit written content for publication,['attention to detail communication writing skills critical thinking organization'],Media & Publishing,Average paying
104,Public Relations Specialist,Manage public image and media relations for organizations,['communication strategic thinking relationship building crisis management creativity'],Marketing,Average paying
105,Advertising Executive,Develop and implement advertising campaigns,['creative thinking strategic planning communication leadership project management'],Advertising,High paying
106,Art Director,Oversee visual aspects of advertising and media projects,['creative leadership visual communication project management team management'],Advertising,High paying
107,Copywriter,Write persuasive content for advertising and marketing,['creative writing communication persuasion brand awareness research skills'],Advertising,Average paying
108,Film Director,Direct actors and crew in film and video production,['leadership creative vision communication project management decision making'],Entertainment,High paying
109,Screenwriter,Write scripts for films television and other media,['creative writing storytelling research skills character development communication'],Entertainment,Average paying
110,Actor,Perform roles in theatrical film and television productions,['creativity memorization emotional expression communication adaptability'],Entertainment,Average paying
111,Musician,Perform music for live audiences and recordings,['creativity discipline performance skills communication collaboration'],Entertainment,Average paying
112,Sound Engineer,Operate audio equipment for recordings and live events,['technical aptitude attention to detail problem solving communication creativity'],Entertainment,Average paying
113,Video Game Designer,Design gameplay mechanics and overall game experience,['creative problem solving systems thinking user experience design innovation logical reasoning'],Gaming,High paying
114,Animation Artist,Create animated sequences for films games and media,['creativity visual storytelling attention to detail patience technical aptitude'],Entertainment,Average paying
115,Comic Book Artist,Create artwork and illustrations for comic books,['creativity visual storytelling character development attention to detail time management'],Entertainment,Average paying
116,Fashion Model,Model clothing and accessories for fashion shows and photography,['physical fitness professionalism adaptability communication self-discipline'],Fashion,Average paying
117,Dance Instructor,Teach dance techniques and choreography to students,['physical coordination communication teaching skills creativity patience'],Arts & Culture,Low paying
118,Yoga Instructor,Lead yoga classes and provide instruction in yoga practices,['physical fitness communication teaching skills mindfulness empathy'],Fitness & Recreation,Low paying
119,Sports Coach,Train athletes and develop game strategies,['leadership communication motivation strategic thinking physical fitness'],Sports,Average paying
120,Athletic Trainer,Provide injury prevention and treatment for athletes,['physical assessment communication problem solving safety awareness empathy'],Sports,Average paying
121,Recreation Coordinator,Plan and organize recreational activities and programs,['organization communication leadership time management creativity'],Recreation,Average paying
122,Camp Counselor,Supervise and lead activities for children at camps,['communication patience leadership safety awareness creativity'],Recreation,Low paying
123,Cruise Director,Organize entertainment and activities for cruise passengers,['communication leadership entertainment skills organization customer service'],Hospitality,Average paying
124,Travel Agent,Plan and book travel arrangements for clients,['customer service organization communication research skills problem solving'],Travel & Tourism,Average paying
125,Hotel Manager,Oversee hotel operations and ensure guest satisfaction,['leadership customer service problem solving financial management communication'],Hospitality,Average paying
126,Restaurant Manager,Manage restaurant operations and staff,['leadership communication customer service problem solving time management'],Food Service,Average paying
127,Catering Manager,Plan and coordinate catering events and services,['organization leadership communication time management customer service'],Food Service,Average paying
128,Wedding Planner,Plan and coordinate wedding ceremonies and receptions,['organization communication attention to detail time management customer service'],Event Planning,Average paying
129,Florist,Design and arrange flowers for various occasions,['creativity color theory customer service manual dexterity attention to detail'],Retail,Low paying
130,Baker,Bake bread pastries and other baked goods,['attention to detail time management creativity safety awareness quality control'],Food Service,Low paying
131,Butcher,Cut and prepare meat products for sale,['manual dexterity safety awareness customer service attention to detail product knowledge'],Food Service,Low paying
132,Farmer,Grow crops and raise livestock for food production,['physical stamina problem solving environmental awareness time management planning'],Agriculture,Low paying
133,Fisherman,Catch fish and other seafood for commercial purposes,['physical stamina safety awareness navigation problem solving environmental awareness'],Agriculture,Low paying
134,Logger,Harvest timber from forests for commercial use,['physical stamina safety awareness environmental awareness equipment operation teamwork'],Forestry,Average paying
135,Miner,Extract minerals and resources from underground mines,['physical stamina safety awareness attention to detail teamwork problem solving'],Mining & Resources,Average paying
136,Oil Rig Worker,Operate equipment on offshore oil drilling platforms,['physical stamina safety awareness teamwork problem solving stress management'],Oil & Gas,High paying
137,Solar Panel Installer,Install and maintain solar energy systems,['safety awareness manual dexterity problem solving physical fitness environmental awareness'],Renewable Energy,Average paying
138,Wind Turbine Technician,Maintain and repair wind energy equipment,['safety awareness physical fitness problem solving manual dexterity environmental awareness'],Renewable Energy,Average paying
139,HVAC Technician,Install and repair heating ventilation and air conditioning systems,['problem solving manual dexterity safety awareness attention to detail customer service'],Construction,Average paying
140,Locksmith,Install and repair locks and security systems,['problem solving manual dexterity attention to detail customer service security awareness'],Security,Average paying
