ID_num,job_title,Short_description,Skills_required,Industry,Pay_grade
415,Green Roof Designer,Create living roof systems for buildings,['landscape architecture environmental science engineering creativity problem solving'],Architecture,Average paying
416,Digital Anthropologist,Study how technology affects human behavior and culture,['anthropology research skills data analysis communication critical thinking'],Social Sciences,High paying
417,Specialty Coffee Roaster,Process coffee beans to create unique flavor profiles,['food science sensory analysis quality control creativity customer service'],Food Production,Average paying
418,Virtual Reality Fitness Instructor,Lead exercise classes in immersive digital environments,['fitness training technology skills communication motivation innovation'],Fitness & Recreation,Average paying
419,Soil Health Specialist,Assess and improve agricultural soil quality,['soil science agriculture environmental science problem solving research skills'],Agriculture,Average paying
420,Digital Rights Lawyer,Practice law focused on technology and online issues,['legal knowledge technology understanding communication problem solving research skills'],Legal Services,High paying
421,Artisanal Ice Cream Maker,Create unique frozen desserts using traditional methods,['culinary arts creativity food safety quality control customer service'],Food Production,Low paying
422,Online Course Instructor,Teach specialized subjects through digital platforms,['subject matter expertise teaching skills communication technology skills adaptability'],Education,Average paying
423,Renewable Energy Sales Consultant,Sell solar panels and clean energy systems to consumers,['sales skills renewable energy knowledge communication problem solving customer service'],Sales,Average paying
424,Digital Marketing Analytics Specialist,Analyze online marketing data to optimize campaigns,['data analysis marketing knowledge problem solving communication technical skills'],Marketing,High paying
425,Heritage Seed Keeper,Preserve heirloom plant varieties for future generations,['botany conservation genetics agriculture research skills'],Environmental Services,Average paying
426,Virtual Reality Game Designer,Create immersive gaming experiences and worlds,['game design programming creativity problem solving user experience'],Gaming,High paying
427,Sustainable Building Inspector,Evaluate construction projects for environmental compliance,['building codes environmental standards attention to detail communication problem solving'],Construction,Average paying
428,Digital Wellness Researcher,Study the effects of technology on human health and behavior,['research methods psychology data analysis communication critical thinking'],Science & Research,High paying
429,Artisanal Chocolate Maker,Craft small batch chocolates using traditional techniques,['culinary arts creativity quality control food safety customer service'],Food Production,Average paying
430,Online Community Moderator,Maintain safe and productive digital discussion spaces,['communication problem solving critical thinking conflict resolution attention to detail'],Technology,Low paying
431,Permeable Pavement Installer,Install eco friendly surfaces that allow water drainage,['construction skills environmental science problem solving safety protocols technical skills'],Construction,Average paying
432,Digital Asset Appraiser,Evaluate the value of cryptocurrency and digital collectibles,['financial analysis technology knowledge research skills communication problem solving'],Finance,High paying
433,Specialty Tea Blender,Create unique tea combinations and flavor profiles,['culinary arts sensory analysis creativity quality control customer service'],Food Production,Average paying
434,Virtual Reality Training Developer,Create immersive educational and skills training programs,['instructional design programming 3d modeling communication innovation'],Education,High paying
435,Carbon Credit Analyst,Evaluate and trade environmental impact offsets,['environmental science financial analysis research skills communication problem solving'],Environmental Services,High paying
436,Digital Nomad Visa Consultant,Advise on immigration requirements for remote workers,['immigration law research skills communication problem solving cultural awareness'],Legal Services,Average paying
437,Aquaponics Farmer,Grow plants and fish together in sustainable systems,['agriculture aquaculture systems thinking problem solving environmental science'],Agriculture,Average paying
438,Online Reputation Manager,Monitor and improve digital presence for individuals and businesses,['digital marketing communication problem solving research skills strategic thinking'],Marketing,Average paying
439,Green Chemistry Researcher,Develop environmentally friendly chemical processes,['chemistry environmental science research skills innovation problem solving'],Science & Research,High paying
440,Digital Estate Executor,Manage digital assets and accounts after someone passes away,['legal knowledge technology skills communication problem solving organization'],Legal Services,Average paying
441,Botanical Illustrator,Create scientific drawings of plants and flowers,['artistic skills botany attention to detail communication scientific knowledge'],Arts & Sciences,Average paying
442,Virtual Reality Social Worker,Provide counseling and support through immersive technology,['social work technology skills empathy communication innovation'],Social Services,High paying
443,Indigenous Plant Specialist,Cultivate and preserve native plant species,['botany conservation biology cultural awareness research skills problem solving'],Environmental Services,Average paying
444,Digital Literacy Instructor,Teach technology skills to underserved populations,['teaching skills technology knowledge communication patience cultural sensitivity'],Education,Low paying
445,Sustainable Fashion Designer,Create clothing with minimal environmental impact,['fashion design environmental awareness creativity innovation problem solving'],Fashion,Average paying
446,Virtual Assistant Services Manager,Coordinate remote administrative support teams,['management communication organization problem solving technology skills'],Business Services,Average paying
447,Rainforest Conservation Guide,Lead educational tours while protecting tropical ecosystems,['environmental science teaching skills communication physical fitness conservation biology'],Environmental Services,Average paying
448,Digital Payment Security Analyst,Protect online financial transactions from fraud,['cybersecurity financial systems problem solving attention to detail communication'],Finance,High paying
449,Artisanal Bread Baker,Create traditional breads using time honored techniques,['culinary arts attention to detail quality control creativity customer service'],Food Production,Average paying
450,Online Learning Support Specialist,Help students navigate digital educational platforms,['education technology communication problem solving customer service'],Education,Low paying
451,Green Building Consultant,Advise on sustainable construction practices and materials,['architecture environmental science building codes communication problem solving'],Construction,High paying
452,Digital Privacy Educator,Teach individuals and organizations about online security,['cybersecurity teaching skills communication technology knowledge problem solving'],Education,Average paying
453,Heritage Fruit Tree Cultivator,Grow and preserve rare and antique fruit varieties,['horticulture conservation biology agriculture research skills problem solving'],Agriculture,Average paying
454,Virtual Reality Meditation Guide,Lead mindfulness sessions in immersive digital environments,['meditation teaching technology skills communication mindfulness training'],Wellness,Average paying
455,Waste Stream Analyst,Study material flows to reduce environmental impact,['environmental science data analysis research skills problem solving communication'],Environmental Services,Average paying
456,Digital Content Creator,Produce engaging multimedia content for online audiences,['creativity communication technology skills marketing problem solving'],Media & Publishing,Average paying
457,Regenerative Agriculture Specialist,Implement farming practices that restore soil health,['agriculture environmental science research skills problem solving systems thinking'],Agriculture,Average paying
458,Online Business Coach,Help entrepreneurs build successful digital enterprises,['business consulting communication coaching skills problem solving strategic thinking'],Business Services,Average paying
459,Biochar Production Specialist,Create carbon sequestering soil amendments from organic waste,['environmental science chemistry agriculture innovation problem solving'],Environmental Services,Average paying
460,Digital Marketing Strategist,Develop comprehensive online marketing campaigns,['marketing strategy communication analytical thinking creativity problem solving'],Marketing,High paying
461,Traditional Craft Instructor,Teach historical handicraft techniques and skills,['craftsmanship teaching skills communication cultural knowledge patience'],Arts & Culture,Low paying
462,Virtual Events Technical Director,Manage technology for online conferences and gatherings,['technology skills problem solving communication project management innovation'],Technology,Average paying
463,Pollinator Habitat Restorer,Create and maintain spaces for bees butterflies and beneficial insects,['ecology conservation biology environmental science problem solving research skills'],Environmental Services,Average paying
464,Digital Transformation Consultant,Help organizations adapt to new technologies and processes,['business consulting technology strategy communication problem solving change management'],Consulting,High paying
465,Artisanal Fermented Foods Producer,Create traditional cultured foods like kimchi and sauerkraut,['food science fermentation cultural knowledge quality control customer service'],Food Production,Average paying
466,Online Community Builder,Create and grow digital spaces for shared interests and goals,['community management communication social media problem solving relationship building'],Technology,Average paying
467,Ecological Restoration Coordinator,Plan and oversee habitat rehabilitation projects,['environmental science project management research skills communication problem solving'],Environmental Services,High paying
468,Digital Product Manager,Oversee development and launch of software products and applications,['product management technology strategy communication problem solving leadership'],Technology,High paying
469,Sustainable Tourism Guide,Lead eco friendly travel experiences while preserving destinations,['tourism environmental awareness communication cultural knowledge problem solving'],Tourism,Average paying
470,Virtual Reality Healthcare Developer,Create medical training and patient treatment applications,['healthcare technology programming innovation problem solving'],Healthcare,High paying
471,Indigenous Food Sovereignty Advocate,Promote traditional food systems and cultural preservation,['cultural awareness advocacy skills communication research skills problem solving'],Social Services,Average paying
472,Digital Analytics Consultant,Help organizations understand and optimize their online performance,['data analysis marketing technology communication problem solving'],Consulting,High paying
473,Artisanal Soap and Cosmetics Maker,Create natural personal care products using traditional methods,['chemistry creativity quality control safety protocols customer service'],Manufacturing,Low paying
474,Online Education Quality Assurance Specialist,Ensure digital learning programs meet educational standards,['education quality control communication problem solving attention to detail'],Education,Average paying
475,Climate Adaptation Planner,Help communities prepare for environmental changes,['environmental science urban planning communication problem solving research skills'],Environmental Services,High paying
476,Digital Accessibility Developer,Create inclusive technology solutions for people with disabilities,['web development accessibility standards problem solving communication innovation'],Technology,High paying
477,Heritage Livestock Guardian,Protect and preserve rare farm animal breeds,['animal husbandry conservation biology genetics problem solving research skills'],Agriculture,Average paying
478,Virtual Reality Architecture Visualizer,Create immersive previews of building designs,['architecture 3d modeling technology skills creativity communication'],Architecture,Average paying
479,Ecosystem Services Valuer,Quantify the economic benefits of natural environments,['environmental economics research skills data analysis communication problem solving'],Environmental Services,High paying
480,Digital Brand Strategist,Develop online identity and positioning for organizations,['branding marketing strategy communication creativity problem solving'],Marketing,High paying
481,Traditional Building Craft Specialist,Preserve historical construction techniques and skills,['construction cultural heritage manual dexterity problem solving teaching skills'],Construction,Average paying
482,Online Learning Community Manager,Foster engagement and connection in educational platforms,['community management education communication problem solving technology skills'],Education,Average paying
483,Renewable Energy Project Developer,Plan and implement clean energy installations,['project management renewable energy finance communication problem solving'],Renewable Energy,High paying
484,Digital Employee Experience Designer,Optimize remote work environments and company culture,['human resources technology skills communication problem solving psychology'],Human Resources,High paying
485,Artisanal Pickle and Preserve Maker,Create traditional preserved foods using time honored methods,['food science food safety creativity quality control customer service'],Food Production,Low paying
486,Virtual Reality Sports Trainer,Use immersive technology to improve athletic performance,['sports training technology skills communication motivation innovation'],Sports,Average paying
487,Biodiversity Conservation Coordinator,Protect and restore species and habitat diversity,['conservation biology environmental science research skills problem solving communication'],Environmental Services,High paying
488,Digital Marketing Automation Developer,Create systems that automate online marketing processes,['marketing technology programming problem solving innovation'],Marketing,High paying
489,Traditional Medicine Plant Cultivator,Grow herbs and plants used in historical healing practices,['botany traditional medicine agriculture research skills problem solving'],Agriculture,Average paying
490,Online Workshop Facilitator,Lead interactive learning sessions through digital platforms,['teaching skills communication technology skills problem solving group dynamics'],Education,Average paying
491,Sustainable Water Systems Designer,Create eco friendly water treatment and distribution systems,['environmental engineering water management problem solving innovation sustainability'],Environmental Services,High paying
492,Digital Customer Experience Analyst,Study and improve online user interactions and satisfaction,['user experience research data analysis communication problem solving'],Technology,High paying
493,Heritage Grain Grower and Miller,Cultivate and process ancient wheat and grain varieties,['agriculture food processing traditional skills quality control problem solving'],Agriculture,Average paying
494,Virtual Reality Museum Curator,Create immersive cultural and educational experiences,['museum studies technology skills communication creativity research skills'],Cultural Heritage,Average paying
495,Ecological Economist,Study the relationship between economic systems and environmental health,['economics environmental science research skills communication problem solving'],Economics,High paying
496,Digital Wellness Program Coordinator,Develop and manage technology balance initiatives for organizations,['wellness coaching program management communication problem solving psychology'],Wellness,Average paying
497,Artisanal Fiber Artist and Dyer,Create textiles using traditional techniques and natural materials,['textile arts creativity manual dexterity cultural knowledge customer service'],Arts & Crafts,Low paying
498,Online Course Technical Producer,Manage the technical aspects of digital educational content creation,['education technology video production problem solving communication'],Education,Average paying
499,Climate Change Communication Specialist,Translate scientific research into accessible public information,['environmental science communication research skills problem solving public speaking'],Environmental Services,Average paying
500,Digital Innovation Consultant,Help organizations adopt emerging technologies and future focused strategies,['technology strategy innovation management communication problem solving'],Consulting,High paying
501,Machine Learning Engineer,Design and implement ML algorithms for production systems,['python; tensorflow; statistics; cloud platforms; data engineering'],Technology,High paying
502,Cybersecurity Architect,Design comprehensive security frameworks for enterprise systems,['security protocols; risk assessment; network security; compliance; leadership'],Technology,High paying
503,Product Owner,Define product vision and manage development roadmap,['agile methodologies; stakeholder management; analytics; market research; communication'],Technology,High paying
504,Cloud Solutions Architect,Design scalable cloud infrastructure and migration strategies,['aws/azure; microservices; devops; system design; cost optimization'],Technology,High paying
505,AI Research Scientist,Conduct advanced research in artificial intelligence and machine learning,['deep learning; research methodology; statistical analysis; python; publications'],Science & Research,High paying
506,Blockchain Developer,Develop decentralized applications and smart contracts,['solidity; web3; cryptography; distributed systems; javascript'],Technology,High paying
507,Investment Banking Analyst,Analyze financial markets and support M&A transactions,['financial modeling; valuation; excel; powerpoint; market analysis'],Finance,High paying
508,Petroleum Engineer,Design extraction methods for oil and gas resources,['reservoir engineering; drilling technology; geology; safety protocols; cad'],Oil & Gas,High paying
509,Neurosurgeon,Perform complex brain and nervous system surgeries,['medical expertise; surgical skills; precision; decision making; stamina'],Healthcare,High paying
510,Aerospace Engineer,Design aircraft and spacecraft systems,['aerodynamics; cad; materials science; systems engineering; testing'],Aerospace,High paying
511,Clinical Research Scientist,Lead clinical trials for new medical treatments,['clinical trial design; statistical analysis; regulatory knowledge; medical writing; ethics'],Healthcare,High paying
512,Quantitative Analyst,Develop mathematical models for financial trading,['mathematics; python/r; statistics; risk management; financial markets'],Finance,High paying
513,Senior Software Architect,Design large-scale software systems and technical strategy,['system design; architecture patterns; leadership; multiple programming languages; scalability'],Technology,High paying
514,Data Engineering Manager,Lead teams building data infrastructure and pipelines,['data architecture; team leadership; big data tools; cloud platforms; strategy'],Technology,High paying
515,Pharmaceutical Scientist,Research and develop new drugs and medical treatments,['chemistry; pharmacology; clinical research; regulatory affairs; laboratory skills'],Healthcare,High paying
516,Chief Information Officer,Oversee enterprise IT strategy and digital transformation,['it strategy; leadership; digital transformation; budgeting; risk management'],Executive Leadership,High paying
517,Principal Consultant,Provide expert advisory services to Fortune 500 companies,['industry expertise; strategic thinking; client management; presentation skills; analytics'],Consulting,High paying
518,Biomedical Engineer,Design medical devices and equipment,['engineering design; biology; medical device regulations; cad; testing'],Healthcare,High paying
519,Corporate Finance Director,Manage corporate financial strategy and capital allocation,['financial planning; m&a; capital markets; leadership; strategic analysis'],Finance,High paying
520,Lead UX Researcher,Conduct user research to inform product design decisions,['user research methods; data analysis; psychology; prototyping; communication'],Technology,High paying
521,Solutions Engineer,Provide technical expertise to support sales and implementations,['technical sales; problem solving; communication; software architecture; customer success'],Technology,Average paying
522,Digital Marketing Specialist,Develop and execute digital marketing campaigns,['seo/sem; social media; analytics; content marketing; a/b testing'],Marketing,Average paying
523,Technical Writer,Create documentation for software and technical products,['technical writing; documentation tools; software understanding; communication; research'],Technology,Average paying
524,Business Intelligence Analyst,Analyze business data to support decision making,['sql; tableau/powerbi; data analysis; business acumen; reporting'],Business Services,Average paying
525,Scrum Master,Facilitate agile development processes and team collaboration,['agile methodologies; team facilitation; conflict resolution; project management; communication'],Technology,Average paying
526,Quality Assurance Engineer,Ensure software quality through testing and validation,['test automation; bug tracking; testing methodologies; scripting; attention to detail'],Technology,Average paying
527,Recruitment Specialist,Source and recruit talent for various organizational roles,['talent acquisition; interviewing; networking; communication; ats systems'],Human Resources,Average paying
528,Financial Planner,Provide financial planning and investment advice to clients,['financial planning; investment knowledge; client relations; regulatory compliance; mathematics'],Finance,Average paying
529,Operations Research Analyst,Use analytical methods to solve complex business problems,['operations research; statistical analysis; optimization; mathematical modeling; programming'],Business Services,Average paying
530,Environmental Consultant,Assess environmental impact and ensure regulatory compliance,['environmental science; regulatory knowledge; data collection; report writing; site assessment'],Environmental Services,Average paying
531,Instructional Designer,Design educational content and training programs,['learning theory; curriculum development; e-learning tools; assessment design; communication'],Education,Average paying
532,Supply Chain Analyst,Optimize supply chain operations and logistics,['supply chain management; data analysis; forecasting; process improvement; erp systems'],Logistics,Average paying
533,Market Research Analyst,Conduct market research to identify business opportunities,['market research; statistical analysis; survey design; data interpretation; presentation skills'],Marketing,Average paying
534,Systems Administrator,Maintain and troubleshoot IT infrastructure and systems,['system administration; networking; troubleshooting; scripting; security'],Technology,Average paying
535,Credit Analyst,Evaluate creditworthiness of individuals and organizations,['credit analysis; financial statement analysis; risk assessment; regulatory knowledge; attention to detail'],Finance,Average paying
536,Training Coordinator,Organize and deliver training programs for employees,['training development; presentation skills; learning management systems; communication; organization'],Human Resources,Average paying
537,Database Administrator,Manage and maintain database systems and data integrity,['database management; sql; backup and recovery; performance tuning; security'],Technology,Average paying
538,Compliance Officer,Ensure organizational adherence to regulatory requirements,['regulatory knowledge; risk assessment; audit skills; communication; attention to detail'],Legal Services,Average paying
539,User Experience Designer,Design intuitive and engaging user interfaces,['ux design; prototyping; user research; visual design; interaction design'],Technology,Average paying
540,Social Media Manager,Manage social media presence and engagement strategies,['social media platforms; content creation; analytics; community management; brand management'],Marketing,Average paying
541,Laboratory Technician,Conduct scientific tests and experiments in laboratory settings,['laboratory techniques; data collection; scientific equipment; safety protocols; attention to detail'],Science & Research,Average paying
542,Purchasing Agent,Negotiate and manage procurement of goods and services,['negotiation; vendor management; cost analysis; contract management; supply chain knowledge'],Business Services,Average paying
543,Health Information Technician,Manage and organize healthcare data and records,['medical coding; health information systems; data management; privacy regulations; attention to detail'],Healthcare,Average paying
544,Paralegal,Provide legal support and research assistance,['legal research; document preparation; case management; legal software; communication'],Legal Services,Average paying
545,Event Coordinator,Plan and execute corporate and special events,['event planning; vendor management; budget management; communication; time management'],Event Planning,Average paying
